Lot Name,Zone,Price,Duration
"135 Fennell Ave W , Hamilton, ON",Zone 5760,$6,2 Hours
"Hamilton Campus - 1842 King St. E , Hamilton, ON",Zone 2462,$6,2 Hours
"685, 695, 705 Surrey Lane , Hamilton, ON",Zone 5040,$5,2 Hours
"LOT 6-430 BROCK AVE , Hamilton, ON",Zone 2206,$0,Unlimited
"LOT 12-SPENCER'S AT THE WATERFRONT , Hamilton, ON",Zone 2211,N/A,2 Hours
"BROCK AVE BETWEEN LAKESHORE & ELGIN , Hamilton, ON",Zone 2235,$0,Unlimited
"BROCK AVE BETWEEN ELGIN ST. & ONTARIO ST. , Hamilton, ON",Zone 2210,$0,Unlimited
"LOT 15-475 BROCK AVE , Hamilton, ON",Zone 2213,$0,Unlimited
"ELGIN ST BETWEEN BROCK & NELSON , Hamilton, ON",Zone 2255,$0,Unlimited
"NELSON AVE BETWEEN LAKESHORE & ELGIN , Hamilton, ON",Zone 2234,$0,Unlimited
"Lot - Waterfront EAST , Hamilton, ON",Zone 2256,N/A,2 Hours
"ELGIN ST BETWEEN BURLINGTON & NELSON , Hamilton, ON",Zone 2254,$0,Unlimited
"ONTARIO ST. BETWEEN HURD AVE & BURLINGTON AVE , Hamilton, ON",Zone 2230,$0,Unlimited
"ELGIN ST BETWEEN LOCUST & BURLINGTON , Hamilton, ON",Zone 2253,$0,Unlimited
"ONTARIO ST BETWEEN HURD & LOCUST , Hamilton, ON",Zone 2238,$0,Unlimited
"LOT 414-WATERFRONT PARKING GARAGE , Hamilton, ON",Zone 2214,$0,Unlimited
"LOCUST ST BETWEEN LAKESHORE & ELGIN , Hamilton, ON",Zone 2233,$0,Unlimited
"LOT 7-500 LOCUST ST , Hamilton, ON",Zone 2207,$0,Unlimited
"LOCUST ST BETWEEN ELGIN & ONTARIO , Hamilton, ON",Zone 2232,$0,Unlimited
"ONTARIO ST BETWEEN LOCUST & BRANT , Hamilton, ON",Zone 2239,$0,Unlimited
"LOT 13-426 BRANT ST , Hamilton, ON",Zone 2212,$0,Unlimited
"LOT 8-523 LOCUST ST , Hamilton, ON",Zone 2208,$0,Unlimited
"BRANT ST WEST SIDE BETWEEN LAKESHORE & ELGIN , Hamilton, ON",Zone 2231,$0,Unlimited
"BRANT ST EAST SIDE BETWEEN LAKESHORE & PINE , Hamilton, ON",Zone 2228,$0,Unlimited
"BRANT ST EAST SIDE BETWEEN PINE & JAMES , Hamilton, ON",Zone 2227,$0,Unlimited
"CAROLINE ST BETWEEN LOCUST & BRANT , Hamilton, ON",Zone 2236,$0,Unlimited
"BRANT ST WEST SIDE BETWEEN ONTARIO & CAROLINE , Hamilton, ON",Zone 2229,$0,Unlimited
"BRANT ST EAST SIDE BETWEEN JAMES & MARIA , Hamilton, ON",Zone 2226,$0,Unlimited
"PINE ST BETWEEN BRANT & JOHN , Hamilton, ON",Zone 2243,$0,Unlimited
"BRANT ST EAST SIDE BETWEEN MARIA & CAROLINE , Hamilton, ON",Zone 2225,$0,Unlimited
"LOT 5-391 BRANT ST , Hamilton, ON",Zone 2205,$0,Unlimited
"JAMES ST BETWEEN BRANT & JOHN , Hamilton, ON",Zone 2240,$0,Unlimited
"JOHN ST BETWEEN LAKESHORE & PINE , Hamilton, ON",Zone 2217,$0,Unlimited
"JOHN ST BETWEEN PINE & JAMES , Hamilton, ON",Zone 2216,$0,Unlimited
"CAROLINE ST BETWEEN BRANT & JOHN , Hamilton, ON",Zone 2237,$0,Unlimited
"JOHN ST BETWEEN JAMES & MARIA , Hamilton, ON",Zone 2215,$0,Unlimited
"LOT 4-421 JOHN ST (ENTER ELIZABETH) , Hamilton, ON",Zone 2204,$0,Unlimited
"JOHN ST BETWEEN MARIA & CAROLINE , Hamilton, ON",Zone 2202,$0,Unlimited
"JAMES ST BETWEEN JOHN & ELIZABETH , Hamilton, ON",Zone 2241,$0,Unlimited
"ELIZABETH ST BETWEEN PINE & JAMES , Hamilton, ON",Zone 2220,$0,Unlimited
"OLGA DRIVE WEST OF BRANT , Hamilton, ON",Zone 2201,$0,Unlimited
"LOT 3-533 JOHN ST , Hamilton, ON",Zone 2203,N/A,2 Hours
"ELIZABETH ST BETWEEN JAMES & MARIA , Hamilton, ON",Zone 2219,$0,Unlimited
"ELIZABETH ST BETWEEN MARIA & CAROLINE , Hamilton, ON",Zone 2218,$0,Unlimited
"GHENT AVE WEST OF BRANT , Hamilton, ON",Zone 2209,$0,Unlimited
"BRANT ST. BETWEEN GHENT ST & OLGA ST , Hamilton, ON",Zone 2252,$0,Unlimited
"PINE ST BETWEEN ELIZABETH & PEARL , Hamilton, ON",Zone 2244,$0,Unlimited
"JAMES ST BETWEEN ELIZABETH & PEARL , Hamilton, ON",Zone 2242,$0,Unlimited
"LAKESHORE RD BETWEEN ELIZABETH & PEARL , Hamilton, ON",Zone 2246,$0,Unlimited
"LOT 1-431 ELIZABETH ST , Hamilton, ON",Zone 2200,$0,Unlimited
"PEARL ST BETWEEN LAKESHORE & PINE , Hamilton, ON",Zone 2223,$0,Unlimited
"PEARL ST BETWEEN PINE & JAMES , Hamilton, ON",Zone 2222,$0,Unlimited
"PEARL ST BETWEEN JAMES & MARIA , Hamilton, ON",Zone 2221,$0,Unlimited
"PINE ST BETWEEN PEARL & MARTHA , Hamilton, ON",Zone 2245,$0,Unlimited
"OLD LAKESHORE RD , Hamilton, ON",Zone 2247,$0,Unlimited
"MARTHA ST BETWEEN LAKESHORE & PINE , Hamilton, ON",Zone 2224,$0,Unlimited
"Centre for Aviation Technology , Hamilton, ON",Zone 5762,N/A,2 Hours
